{
  "$schema": "https://json-schema.org/draft/2020-12/schema",
  "$id": "https://myelin.metafactory.ai/schemas/envelope/v3",
  "title": "Myelin Envelope",
  "description": "Universal message envelope for the agentic nervous system. One schema for all signals — sovereignty travels with the message. v3 (vocabulary migration 2026-05, breaking cut myelin#183): the `source` grammar is tightened to the fixed-3 form {principal}.{stack}.{assistant} — the legacy `org.agent.instance` 3–5 segment shape is no longer accepted (it was the shape the pilot review-loop bug exploited; see CONTEXT.md line 99). Renames `{org}` → `{principal}` in the published subject grammar. v2 stays published for consumers pinned to the transition grammar; v1 stays published for consumers pinned to the pre-migration grammar.",
  "type": "object",
  "required": ["id", "source", "type", "timestamp", "sovereignty", "payload"],
  "properties": {
    "id": {
      "type": "string",
      "format": "uuid",
      "description": "Unique identifier for this envelope instance."
    },
    "source": {
      "type": "string",
      "pattern": "^[a-z][a-z0-9-]*(\\.[a-z][a-z0-9-]*){2}$",
      "description": "Origin address. Canonical grammar (R6 + myelin#183) is the fixed-3 form {principal}.{stack}.{assistant} — exactly 3 segments. The legacy `org.agent.instance` 3–5 segment shape is no longer accepted (the breaking cut; CONTEXT.md line 99).",
      "examples": ["metafactory.security.luna", "metafactory.pilot.local", "acme.monitor.prod-01"]
    },
    "type": {
      "type": "string",
      "pattern": "^[a-z][a-z0-9-]*(\\.[a-z][a-z0-9-]*){1,4}$",
      "description": "Signal type: domain.entity.action (2-5 segments)",
      "examples": ["code.pr.review", "security.alert.created", "pipeline.job.completed"]
    },
    "timestamp": {
      "type": "string",
      "format": "date-time",
      "description": "ISO-8601 timestamp of envelope creation."
    },
    "correlation_id": {
      "type": "string",
      "format": "uuid",
      "description": "Links related envelopes across a workflow or conversation."
    },
    "sovereignty": {
      "type": "object",
      "description": "The message's passport — declares where it can travel and what can process it.",
      "required": ["classification", "data_residency", "max_hop", "frontier_ok", "model_class"],
      "properties": {
        "classification": {
          "type": "string",
          "enum": ["local", "federated", "public"],
          "description": "local: never leaves org boundary. federated: crosses boundaries subject to sovereignty rules. public: unrestricted."
        },
        "data_residency": {
          "type": "string",
          "pattern": "^[A-Z]{2}$",
          "description": "ISO 3166-1 alpha-2 country code for data residency requirements.",
          "examples": ["CH", "DE", "US"]
        },
        "max_hop": {
          "type": "integer",
          "minimum": 0,
          "description": "Maximum number of federation hops permitted. 0 = origin only."
        },
        "frontier_ok": {
          "type": "boolean",
          "description": "Whether this message may be processed by frontier (cloud) AI models."
        },
        "model_class": {
          "type": "string",
          "enum": ["local-only", "frontier", "any"],
          "description": "Constrains which model class may process this signal."
        }
      },
      "additionalProperties": false
    },
    "economics": {
      "type": "object",
      "description": "F-15: token economics, cost tracking, and billing attribution. Mutable annotation field — intermediaries may aggregate. MUST NOT inform security or trust decisions (architecture.md §5.2).",
      "properties": {
        "budget": {
          "type": "object",
          "description": "Publisher-set constraints on resource usage.",
          "properties": {
            "max_tokens": {
              "type": "integer",
              "minimum": 1,
              "description": "Maximum total tokens (input + output) permitted."
            },
            "max_cost_usd": {
              "type": "number",
              "minimum": 0,
              "description": "Maximum cost in USD."
            }
          },
          "additionalProperties": true
        },
        "actual": {
          "type": "object",
          "description": "Actual resource usage populated by executor; aggregated by hubs in delegate chains.",
          "properties": {
            "input_tokens": { "type": "integer", "minimum": 0 },
            "output_tokens": { "type": "integer", "minimum": 0 },
            "total_tokens": { "type": "integer", "minimum": 0 },
            "model": {
              "type": "string",
              "pattern": "^[a-z][a-z0-9-]*$",
              "description": "Lowercase model identifier (e.g., claude-sonnet-4, gpt-4o)."
            },
            "duration_ms": { "type": "integer", "minimum": 0 },
            "cost_usd": { "type": "number", "minimum": 0 }
          },
          "additionalProperties": true
        },
        "wallet": {
          "type": "string",
          "pattern": "^did:mf:[a-z](?:[a-z0-9._]|-(?!-))+$",
          "description": "DID of principal receiving/paying for this work."
        },
        "billing_ref": {
          "type": "string",
          "maxLength": 256,
          "description": "External invoice or tracking reference."
        },
        "currency": {
          "type": "string",
          "pattern": "^[A-Z]{3}$",
          "description": "ISO 4217 currency code when not USD."
        }
      },
      "additionalProperties": true
    },
    "signed_by": {
      "description": "Identity chain (myelin#31). Each stamp signs the canonical bytes of the envelope including the prior chain — tampering with any earlier stamp invalidates every subsequent stamp. Accepted shapes: a single stamp object (legacy back-compat shim, normalized to a one-element chain) or an array of stamps (canonical form).",
      "oneOf": [
        { "$ref": "#/$defs/signedByStamp" },
        {
          "type": "array",
          "minItems": 1,
          "maxItems": 16,
          "items": { "$ref": "#/$defs/signedByStamp" }
        }
      ]
    },
    "extensions": {
      "type": "object",
      "description": "Forward-compatible extension point. Use for routing hints, debug context, trace IDs, or domain-specific metadata without requiring a schema version bump.",
      "additionalProperties": true
    },
    "payload": {
      "type": "object",
      "description": "Arbitrary signal content. Structure is domain-specific — the envelope does not constrain payload shape."
    },
    "requirements": {
      "type": "array",
      "description": "F-021: capability tags the task needs. Match against AGENT_CAPABILITIES KV (myelin#9). Empty array = no filter. Pattern parallels DID_RE — no trailing or consecutive hyphens.",
      "items": {
        "type": "string",
        "pattern": "^[a-z](?:[a-z0-9]|-(?!-)){0,62}[a-z0-9]$"
      },
      "maxItems": 10,
      "examples": [["code-review", "typescript"], ["security-scan"]]
    },
    "sovereignty_required": {
      "type": "string",
      "enum": ["open", "selective", "strict", "bidding"],
      "description": "F-021: minimum agent sovereignty mode. open = ack all; selective = evaluate-and-may-nak; strict = explicit capability + sovereignty match; bidding (F-10) = broadcast bid-request, collect signed responses, select winner."
    },
    "deadline": {
      "type": "string",
      "format": "date-time",
      "description": "F-021: ISO-8601 absolute soft deadline. Informs nak `not-now` decisions."
    },
    "distribution_mode": {
      "type": "string",
      "enum": ["broadcast", "offer", "direct", "delegate"],
      "description": "F-021: routing semantics. offer = competing consumers; direct = named recipient; delegate = outcome handoff (multi-step orchestration). R11 (vocabulary migration 2026-05): 'broadcast' renamed to 'offer'. Transition release accepts BOTH; 'broadcast' is deprecated and dropped in the breaking major."
    },
    "target_assistant": {
      "type": "string",
      "pattern": "^did:mf:[a-z](?:[a-z0-9._]|-(?!-))+$",
      "description": "F-021: required when distribution_mode is direct or delegate. DID of the receiving assistant. R13 (vocabulary migration 2026-05): renamed from 'target_principal'."
    },
    "target_principal": {
      "type": "string",
      "pattern": "^did:mf:[a-z](?:[a-z0-9._]|-(?!-))+$",
      "description": "DEPRECATED (vocabulary migration 2026-05, R13) — renamed to 'target_assistant'. Accepted on read through the transition window for pre-migration / JetStream-replayed envelopes; an envelope carrying BOTH keys is rejected (dual_field_conflict). Removed in the breaking major."
    },
    "originator": {
      "type": "object",
      "description": "myelin#160: policy-level actor identity, separate from the cryptographic signed_by chain. The chain proves WHO signed; originator names WHO the signer claims to be acting on behalf of. Covered by the signature (signer commits to the attribution claim). When absent, the signer is the actor. R2 (vocabulary migration 2026-05): the actor-DID field renamed 'principal'→'identity'; transition release accepts either, rejects both.",
      "oneOf": [
        { "required": ["identity", "attribution"] },
        { "required": ["principal", "attribution"] }
      ],
      "properties": {
        "identity": {
          "type": "string",
          "pattern": "^did:mf:[a-z](?:[a-z0-9._]|-(?!-))+$",
          "description": "DID of the actor whose capabilities this envelope asserts (R2 — renamed from 'principal')."
        },
        "principal": {
          "type": "string",
          "pattern": "^did:mf:[a-z](?:[a-z0-9._]|-(?!-))+$",
          "description": "DEPRECATED (R2) — renamed to 'identity'. Accepted on read through the transition window; an originator carrying BOTH keys is rejected (dual_field_conflict)."
        },
        "attribution": {
          "type": "string",
          "enum": ["adapter-resolved", "federated", "delegated"],
          "description": "How the signer learned the originator identity. adapter-resolved: external (Discord/Slack/HTTP) id mapped to an identity. federated: relayed claim from another network. delegated: signer holds delegation credentials for the originator."
        }
      },
      "additionalProperties": false
    }
  },
  "allOf": [
    {
      "if": {
        "properties": { "distribution_mode": { "enum": ["direct", "delegate"] } },
        "required": ["distribution_mode"]
      },
      "then": {
        "anyOf": [
          { "required": ["target_assistant"] },
          { "required": ["target_principal"] }
        ]
      }
    },
    {
      "comment": "R13 dual_field_conflict — direct/delegate routing target must not carry BOTH the deprecated and renamed key.",
      "not": { "required": ["target_principal", "target_assistant"] }
    }
  ],
  "additionalProperties": false,
  "$defs": {
    "signedByStamp": {
      "type": "object",
      "description": "A single identity attestation in the chain (myelin#31). Discriminated on method. R2 (vocabulary migration 2026-05): the stamp DID field renamed 'principal'→'identity'. This transition schema accepts EITHER key (each method branch requires exactly one of them) and rejects a stamp carrying BOTH via the dualKeyExclusion constraint.",
      "allOf": [
        {
          "oneOf": [
            {
              "required": ["method", "signature", "at"],
              "properties": {
                "method": { "const": "ed25519" },
                "identity": { "type": "string", "pattern": "^did:mf:[a-z](?:[a-z0-9._]|-(?!-))+$" },
                "principal": { "type": "string", "pattern": "^did:mf:[a-z](?:[a-z0-9._]|-(?!-))+$" },
                "signature": { "type": "string", "minLength": 88, "pattern": "^[A-Za-z0-9+/]+=*$" },
                "at": { "type": "string", "format": "date-time" },
                "role": { "$ref": "#/$defs/stampRole" }
              },
              "additionalProperties": false
            },
            {
              "required": ["method", "stamped_by", "signature", "at"],
              "properties": {
                "method": { "const": "hub-stamp" },
                "identity": { "type": "string", "pattern": "^did:mf:[a-z](?:[a-z0-9._]|-(?!-))+$" },
                "principal": { "type": "string", "pattern": "^did:mf:[a-z](?:[a-z0-9._]|-(?!-))+$" },
                "stamped_by": { "type": "string", "pattern": "^did:mf:[a-z](?:[a-z0-9._]|-(?!-))+$" },
                "signature": { "type": "string", "minLength": 88, "pattern": "^[A-Za-z0-9+/]+=*$" },
                "at": { "type": "string", "format": "date-time" },
                "role": { "$ref": "#/$defs/stampRole" }
              },
              "additionalProperties": false
            }
          ]
        },
        {
          "comment": "R2 — a stamp must carry exactly one DID key: 'identity' (canonical) or 'principal' (deprecated). Neither-present and both-present are both rejected.",
          "oneOf": [
            { "required": ["identity"], "not": { "required": ["principal"] } },
            { "required": ["principal"], "not": { "required": ["identity"] } }
          ]
        }
      ]
    },
    "stampRole": {
      "type": "string",
      "enum": ["origin", "transit", "accountability", "sovereignty", "notary"],
      "description": "Semantic role of this stamp in the chain (myelin#31). Optional for back-compat."
    }
  }
}
