{
  "id": "6f1c5b80-3ae2-4a30-9d6c-2f8e2b9af201",
  "source": "metafactory.pilot.local",
  "type": "code.pr.review",
  "timestamp": "2026-06-09T20:00:00Z",
  "correlation_id": "e3b0c442-98fc-1c14-9afb-f4ca0e2c1d3a",
  "sovereignty": {
    "classification": "federated",
    "data_residency": "CH",
    "max_hop": 2,
    "frontier_ok": true,
    "model_class": "any"
  },
  "economics": {},
  "extensions": {
    "subject": "federated.metafactory.default.code.pr.review"
  },
  "payload": {
    "pr_number": 92,
    "repo": "the-metafactory/myelin",
    "title": "feat(envelope): chain-of-stamps in signed_by (myelin#31)",
    "head_sha": "d4f3a7c8b1e2f5a6c9d8e7b4a3c2d1e0f9a8b7c6",
    "base_branch": "main"
  }
}
